{
  "component_fingerprints": {
    "assembly": {
      "policy_sha256": "91f4e21b94263e796c846aedef282c79d4abeb7ccc415a0e6f1311f8816b33a4",
      "release_snapshot_sha256": "ec25ff4e82bd73ef23394b05e71b73298f84f12139028d337e881ddcfddcd8f4"
    },
    "backend": {
      "ahdl_like_sha256": "91ce239e5f278a6d5dfcde85ca2d820c5133d8f8a3de26dc6477164e703342f3",
      "evas_sha256": "e48df10fee21fa1613eb87e8febd0226895e2482f2e91355645d2e93e71e04d7",
      "spectre_sha256": "ac4c1cf785d5eab74058944d52bf40869e83c94e19202ab72c8e8a250c4dc51b"
    },
    "oracle": {
      "checker_binding_sha256": "fb9795cf80d6bb7c72fd42465b937517de1f0dee2eb2a698fc4db5e75d78e5b3",
      "checker_implementation_sha256": "ef0f0b38e15bd9babae0efe79de0a984663c5f666451fb52fcf74d7b21f6f30e",
      "checker_profile_sha256": "1d5456afb8b4281bddfcf8962dfde18b0af5e7bc4762b2078dc8b30f5b83a1bc",
      "diagnostic_policy_sha256": "69b217a349cb0e8a3eab574e7e6d1af03f069fea668b15b37868ef3d2e7deea3",
      "oracle_runner_sha256": "daf6eeded735edd148687b998344d32a4943e8824bac2828f28e9107a7950567",
      "property_activation_policy_sha256": "6d60ef3d4826bfe2ef842cebede2c2eb9f867635acfcf6a1620c3caa4cddd73a"
    },
    "policy_id": "v4-dependency-scoped-evidence-v2",
    "schema_version": "v4-evidence-components-v2",
    "state": "carried_forward",
    "task_inputs": {
      "candidate_bundle_sha256": "30983795275bd7bd28d39e44d3fb42622f36feed4537bbf047848d45fa2ac3f8",
      "deck_sha256": "1a4baa0e94d64d6468dea3fbdada41d2fb7ef34905c4f7a6351361bb787593ed",
      "gold_bundle_sha256": "5123acfa290cef6a0a5240890e2973446d9fa4b7cf6d4cfcb7785d179192a136",
      "harness_spec_sha256": "696f96a6994907b5b9d9bafef0d3ea606b6357b05d7fcf62c41188dd6a3d934c",
      "mutation_bundle_sha256": "30983795275bd7bd28d39e44d3fb42622f36feed4537bbf047848d45fa2ac3f8",
      "profile_sha256": "9bf25459d1f6b1fb0c8c39a64efd6370b4f27cefcfb575adbd86a4be26934923",
      "property_contract_sha256": "da5b7459ea1fb6add8b353a7d74a6b60fe421e77562364d6a34ff6db4f9ed53a",
      "public_support_bundle_sha256": "e3b0c44298fc1c149afbf4c8996fb92427ae41e4649b934ca495991b7852b855",
      "trace_contract_sha256": "6a818040f39be45f3ab8857b5c6ca2a7a3b4f34bf96b4e96e3397753998bf4f5"
    }
  },
  "diagnostics": {
    "expected": "trigger=Implements a conventional count thermometer instead of the source-specific MSB/MSB/LSB mapping.; violated_properties=P_DRIVE_T0_AND_T1_HIGH_TOGETHER",
    "observed": "EVAS: t0@2.525ns=1.000 expected=0.000 t2@2.525ns=0.000 expected=1.000 t0@2.555ns=1.000 expected=0.000 t2@2.555ns=0.000 expected=1.000 t0@2.585ns=1.000 expected=0.000 t2@2.585ns=0.000 expected=1.000; Spectre: t0@2.522ns=1.000 expected=0.000 t2@2.522ns=0.000 expected=1.000 t0@2.595ns=1.000 expected=0.000 t2@2.595ns=0.000 expected=1.000 t0@2.671ns=1.000 expected=0.000 t2@2.671ns=0.000 expected=1.000",
    "violated_property_ids": [
      "P_DRIVE_T0_AND_T1_HIGH_TOGETHER"
    ]
  },
  "evaluators": {
    "ahdl_like": "pass",
    "evas": "compile_pass_behavior_fail",
    "spectre": "compile_pass_behavior_fail"
  },
  "family_id": "219",
  "inputs": {
    "checker_profile_sha256": "d7f8e4a1deda8ce74e1fbc3aeb5b1d493775cf6db1d1e01c8e9c5e18fd370107",
    "harness_spec_sha256": "696f96a6994907b5b9d9bafef0d3ea606b6357b05d7fcf62c41188dd6a3d934c",
    "mutation_bundle_sha256": "30983795275bd7bd28d39e44d3fb42622f36feed4537bbf047848d45fa2ac3f8",
    "profile_sha256": "9bf25459d1f6b1fb0c8c39a64efd6370b4f27cefcfb575adbd86a4be26934923"
  },
  "mutation_id": "neg_002_standard_thermometer",
  "outcome": "killed_behaviorally",
  "release_snapshot_sha256": "ec25ff4e82bd73ef23394b05e71b73298f84f12139028d337e881ddcfddcd8f4",
  "schema_version": "v4-negative-certification-v2",
  "toolchain_lock_sha256": "ec25ff4e82bd73ef23394b05e71b73298f84f12139028d337e881ddcfddcd8f4"
}
