{
  "component_fingerprints": {
    "assembly": {
      "policy_sha256": "91f4e21b94263e796c846aedef282c79d4abeb7ccc415a0e6f1311f8816b33a4",
      "release_snapshot_sha256": "ec25ff4e82bd73ef23394b05e71b73298f84f12139028d337e881ddcfddcd8f4"
    },
    "backend": {
      "ahdl_like_sha256": "91ce239e5f278a6d5dfcde85ca2d820c5133d8f8a3de26dc6477164e703342f3",
      "evas_sha256": "e48df10fee21fa1613eb87e8febd0226895e2482f2e91355645d2e93e71e04d7",
      "spectre_sha256": "ac4c1cf785d5eab74058944d52bf40869e83c94e19202ab72c8e8a250c4dc51b"
    },
    "oracle": {
      "checker_binding_sha256": "68a098912d61497997d938b495e81dd987d8128bc8dce7810056bd6807e32405",
      "checker_implementation_sha256": "1e9c51e6ef788408e4945d21d625fd0de61d9ae221678fca84fb4de5bc4d5d59",
      "checker_profile_sha256": "9179d68c2e67d9fc60f394b3d919bb7623062c216d44cb8d5b9319ed47fd15f1",
      "diagnostic_policy_sha256": "69b217a349cb0e8a3eab574e7e6d1af03f069fea668b15b37868ef3d2e7deea3",
      "oracle_runner_sha256": "daf6eeded735edd148687b998344d32a4943e8824bac2828f28e9107a7950567",
      "property_activation_policy_sha256": "f2838a5d54f2c62a83a853f3a12ccaeebeea24eef3b48357acb0a6f38fb04245"
    },
    "policy_id": "v4-dependency-scoped-evidence-v2",
    "schema_version": "v4-evidence-components-v2",
    "state": "carried_forward",
    "task_inputs": {
      "candidate_bundle_sha256": "1a9ea8a9e4cc5b299c4ae194c62bb592c2598e451a293519d58a138c4a83fda6",
      "deck_sha256": "ec62d69ce4609407d3a63148763b064c18264920d7850e6e6395c171a0798a15",
      "gold_bundle_sha256": "613afc5cbb16041accee404a10acd7f5d83b49d7bfb71c24b7a67d6db01d58b6",
      "harness_spec_sha256": "28c542d88fec1a007eb79d9bbc525780f0e2b5a61833afb39b539d4ce7c557fb",
      "mutation_bundle_sha256": "1a9ea8a9e4cc5b299c4ae194c62bb592c2598e451a293519d58a138c4a83fda6",
      "profile_sha256": "477bf14b396dfd44ae06b64eff890d6a327612f9b89013c90bc0ad8f94e7f747",
      "property_contract_sha256": "43c54ad909e0a2c82589c2ad8b38438d7597e62a41a4bc7f385e15fda6afcd0b",
      "public_support_bundle_sha256": "e3b0c44298fc1c149afbf4c8996fb92427ae41e4649b934ca495991b7852b855",
      "trace_contract_sha256": "d496307f4c1166ea474199a2822fd5b279dcee99d3b0cf4ec6fa8964560504b7"
    }
  },
  "diagnostics": {
    "expected": "trigger=Uses -0.5*vref offset instead of -vref.; violated_properties=P_WHERE_EACH_D_TERM_IS_1",
    "observed": "EVAS: checked=218 max_error=0.45000; Spectre: checked=44 max_error=0.45000",
    "violated_property_ids": [
      "P_WHERE_EACH_D_TERM_IS_1"
    ]
  },
  "evaluators": {
    "ahdl_like": "pass",
    "evas": "compile_pass_behavior_fail",
    "spectre": "compile_pass_behavior_fail"
  },
  "family_id": "215",
  "inputs": {
    "checker_profile_sha256": "5af7f3ecf057affc4169d61951c414eacea73a42fecfff093e7df2d29ad090c0",
    "harness_spec_sha256": "28c542d88fec1a007eb79d9bbc525780f0e2b5a61833afb39b539d4ce7c557fb",
    "mutation_bundle_sha256": "1a9ea8a9e4cc5b299c4ae194c62bb592c2598e451a293519d58a138c4a83fda6",
    "profile_sha256": "477bf14b396dfd44ae06b64eff890d6a327612f9b89013c90bc0ad8f94e7f747"
  },
  "mutation_id": "neg_003_half_offset",
  "outcome": "killed_behaviorally",
  "release_snapshot_sha256": "ec25ff4e82bd73ef23394b05e71b73298f84f12139028d337e881ddcfddcd8f4",
  "schema_version": "v4-negative-certification-v2",
  "toolchain_lock_sha256": "ec25ff4e82bd73ef23394b05e71b73298f84f12139028d337e881ddcfddcd8f4"
}
