{
  "component_fingerprints": {
    "assembly": {
      "policy_sha256": "91f4e21b94263e796c846aedef282c79d4abeb7ccc415a0e6f1311f8816b33a4",
      "release_snapshot_sha256": "563cf8dc56e8652f8055c34f13a5a0cbdba9f7140d030eb4e1185610331f6e33"
    },
    "backend": {
      "ahdl_like_sha256": "91ce239e5f278a6d5dfcde85ca2d820c5133d8f8a3de26dc6477164e703342f3",
      "evas_sha256": "2d71c227644956df64209b49d0da6ef55bc6934891020eb26d762e8cb8cc6df2",
      "spectre_sha256": "ac4c1cf785d5eab74058944d52bf40869e83c94e19202ab72c8e8a250c4dc51b"
    },
    "oracle": {
      "checker_binding_sha256": "0a8facc093e9960496412775f273601b80dfd8b21182829c37a4a7bc7fb08e73",
      "checker_implementation_sha256": "ac71c9c20a02acb207e7281696c6ee56700509f96c6dc599b0fda349f630f487",
      "checker_profile_sha256": "ab15d97a9823557b0518e881e4627f8470d6135be648b631f572d58dc0e8cc00",
      "diagnostic_policy_sha256": "69b217a349cb0e8a3eab574e7e6d1af03f069fea668b15b37868ef3d2e7deea3",
      "oracle_runner_sha256": "e70bd46cd3abdfd8ed9658cb13f64bc96e27d364d51ed0fdcd05f8139e63af2b",
      "property_activation_policy_sha256": "14717234ca16c8ffe671057ce61eb848ffdff781e8b8470f6c167b2af2c66893"
    },
    "policy_id": "v4-dependency-scoped-evidence-v2",
    "schema_version": "v4-evidence-components-v2",
    "state": "carried_forward",
    "task_inputs": {
      "candidate_bundle_sha256": "31d256033a50d1d893af2d00a32587c50c57e31344ee92256a324a3352f4b1b4",
      "deck_sha256": "dfb1ace325f0de447e30a48e55f2ef217a52ac3325a25b61ad9e23252ce989c3",
      "gold_bundle_sha256": "9071eca537c2a74926b13826fd1a94f7cf05620b88449d6e82f837809ba5a7bf",
      "harness_spec_sha256": "2ee243c85873f2325d34e461f7f466430a852495fd6f8b721d217854d6967a72",
      "mutation_bundle_sha256": "31d256033a50d1d893af2d00a32587c50c57e31344ee92256a324a3352f4b1b4",
      "profile_sha256": "4b99db00977e7e992fb5cb3b92cabeea85a7c73e32ca9c039e4d4b112da68f52",
      "property_contract_sha256": "e65bc0adcadf5a7b7836af8df62669b14028574638a99eb89d8bd050120b0a1d",
      "public_support_bundle_sha256": "e3b0c44298fc1c149afbf4c8996fb92427ae41e4649b934ca495991b7852b855",
      "trace_contract_sha256": "073f6beadbc782bbb0d6f147681df7a6107989bfa2121a1db23566241dfdf12c"
    }
  },
  "diagnostics": {
    "expected": "trigger=enable is low after active operation; violated_properties=P_RESET_DISABLE_CLEAR",
    "observed": "EVAS: P_RESET_DISABLE_CLEAR checked=13 mismatch_count=13 expected=vout=0.45 metrics=0 observed=(0.9, 0.0, 0.0) sample_time=0 metric_gap=0.45 ; P_CLOCKED_DATA checked=17 mismatch_count=0 expected=contract_satisfied observed=contract_satisfied sample_time=0 metric_gap=0 ; P_SWING_MAPPING checked=17 mismatch_count=0 expected=contract_satisfied observed=contract_satisfied sample_time=0 metric_gap=0 ; P_DATA_POLARITY checked=17 mismatch_count=0 expected=contract_satisfied observed=contract_satisfied sample_time=0 metric_gap=0 ; P_TRIM_METRIC checked=17 mismatch_count=0 expected=contract_satisfied observed=contract_satisfied sample_time=0 metric_gap=0; Spectre: P_RESET_DISABLE_CLEAR checked=11 mismatch_count=11 expected=vout=0.45 metrics=0 observed=(0.9, 0.0, 0.0) sample_time=0 metric_gap=0.45 ; P_CLOCKED_DATA checked=17 mismatch_count=0 expected=contract_satisfied observed=contract_satisfied sample_time=0 metric_gap=0 ; P_SWING_MAPPING checked=17 mismatch_count=0 expected=contract_satisfied observed=contract_satisfied sample_time=0 metric_gap=0 ; P_DATA_POLARITY checked=17 mismatch_count=0 expected=contract_satisfied observed=contract_satisfied sample_time=0 metric_gap=0 ; P_TRIM_METRIC checked=17 mismatch_count=0 expected=contract_satisfied observed=contract_satisfied sample_time=0 metric_gap=0",
    "violated_property_ids": [
      "P_RESET_DISABLE_CLEAR"
    ]
  },
  "evaluators": {
    "ahdl_like": "pass",
    "evas": "compile_pass_behavior_fail",
    "spectre": "compile_pass_behavior_fail"
  },
  "family_id": "356",
  "inputs": {
    "checker_profile_sha256": "9ae190ebb02aad3dd451d96002b67ffe760718672b8a23cda19ab558ea98d633",
    "harness_spec_sha256": "2ee243c85873f2325d34e461f7f466430a852495fd6f8b721d217854d6967a72",
    "mutation_bundle_sha256": "31d256033a50d1d893af2d00a32587c50c57e31344ee92256a324a3352f4b1b4",
    "profile_sha256": "4b99db00977e7e992fb5cb3b92cabeea85a7c73e32ca9c039e4d4b112da68f52"
  },
  "mutation_id": "neg_004_disable_drives_high",
  "outcome": "killed_behaviorally",
  "release_snapshot_sha256": "563cf8dc56e8652f8055c34f13a5a0cbdba9f7140d030eb4e1185610331f6e33",
  "schema_version": "v4-negative-certification-v2",
  "toolchain_lock_sha256": "563cf8dc56e8652f8055c34f13a5a0cbdba9f7140d030eb4e1185610331f6e33"
}
